{
    "owner": "str, user_id",
    "name": "str",
    "quantity": 1.5,
    "shop": "shop name",
    "last_bought": "<date>",
    "price": {
        "currency": "str, 3-letter currency code",
        "amount": 2
    },
    "consumers": [
        "inhabitant categories; default - adult (one item)",
        "adult", 
        "child"
    ],
    "run_out_at": {
        "deadline": "date",
        "type": "calculated | manual"
    },
    "notification": {
        "run_out_soon": true,
        "ran_out": false
    }
}
